{
  "schema": "arcanea.release_manifest.v1",
  "canonStatus": "LOCKED",
  "identity": {
    "worldId": "w-123",
    "seriesId": "s-456",
    "workId": "wk-789",
    "releaseId": "rel-001",
    "editionId": "e-101",
    "channelId": "ch-202"
  },
  "references": {
    "manuscriptId": "ms-303",
    "lockedCanonCommit": "a1b2c3d4e5f6"
  },
  "rights": {
    "commercialCleared": true,
    "licenseType": "Arcanea Commercial v1",
    "territory": "Worldwide",
    "aiGeneratedDisclosure": false,
    "aiAssistedDisclosure": true
  },
  "approvals": {
    "editorial": true,
    "continuity": true,
    "epubCheck": true,
    "preview": true,
    "human": true
  }
}
